{
  "project_id": "il",
  "schema_version": "1.0.0",
  "head_revision": 0,
  "last_verified_revision": 0,
  "compiler_version": "0.1.0",
  "runtime_version": "0.1.0",
  "target": "x86_64-unknown-linux-gnu",
  "open_tasks": [],
  "blocked_tasks": [
    "P10",
    "E01",
    "E02",
    "E03",
    "E04",
    "E05"
  ],
  "failed_tasks": [],
  "locks": {}
}
